{
 "$schema": "http://json-schema.org/draft-07/schema#",
 "additionalProperties": false,
 "properties": {
  "app": {
   "additionalProperties": false,
   "properties": {
    "evidence": {
     "items": {
      "additionalProperties": false,
      "properties": {
       "file": {
        "type": "string"
       },
       "line": {
        "type": "integer"
       }
      },
      "required": [
       "file"
      ],
      "type": "object"
     },
     "minItems": 1,
     "type": "array"
    },
    "modules": {
     "items": {
      "additionalProperties": false,
      "properties": {
       "entry": {
        "type": "boolean"
       },
       "functions": {
        "type": "integer"
       },
       "kind": {
        "enum": [
         "program",
         "form",
         "library"
        ]
       },
       "name": {
        "type": "string"
       }
      },
      "required": [
       "name",
       "kind"
      ],
      "type": "object"
     },
     "type": "array"
    },
    "name": {
     "type": "string"
    },
    "packaging": {
     "enum": [
      "4gl"
     ]
    }
   },
   "required": [
    "name",
    "packaging"
   ],
   "type": "object"
  },
  "counts": {
   "type": "object"
  },
  "libs": {
   "items": {
    "properties": {
     "name": {
      "type": "string"
     },
     "scope": {
      "enum": [
       "internal",
       "third-party",
       "unknown"
      ]
     },
     "version": {
      "type": [
       "string",
       "null"
      ]
     }
    },
    "required": [
     "name"
    ],
    "type": "object"
   },
   "type": "array"
  },
  "stack": {
   "properties": {
    "databases": {
     "items": {
      "type": "string"
     },
     "type": "array"
    },
    "framework": {
     "type": "string"
    },
    "languages": {
     "items": {
      "type": "string"
     },
     "type": "array"
    },
    "server": {
     "type": "string"
    }
   },
   "type": "object"
  }
 },
 "required": [
  "app"
 ],
 "title": "inventory facts (4gl)",
 "type": "object"
}
